{
  "cluster": "Vagrant_SingleNode",
  "frameworks": [
    {
      "TASK_ERROR": 0,
      "TASK_FAILED": 0,
      "TASK_FINISHED": 22,
      "TASK_KILLED": 0,
      "TASK_LOST": 0,
      "TASK_RUNNING": 1,
      "TASK_STAGING": 0,
      "TASK_STARTING": 0,
      "hostname": "dcos-01",
      "id": "20150827-210452-1695027628-5050-1445-0000",
      "name": "cassandra-healthy",
      "offered_resources": {
        "cpus": 0,
        "disk": 0,
        "mem": 0
      },
      "pid": "scheduler-88e0ffb7-5d54-4bc4-984b-e546d4b1ebb1@172.17.8.101:47277",
      "slave_ids": [
        "20151002-000353-1695027628-5050-1177-S0"
      ],
      "used_resources": {
        "cpus": 0.1,
        "disk": 0,
        "mem": 16,
        "ports": "[10000-10000]"
      },
      "webui_url": "http://$($MESOS_IP_DISCOVERY_COMMAND):8080"
    },
    {
      "TASK_ERROR": 0,
      "TASK_FAILED": 0,
      "TASK_FINISHED": 22,
      "TASK_KILLED": 0,
      "TASK_LOST": 0,
      "TASK_RUNNING": 1,
      "TASK_STAGING": 0,
      "TASK_STARTING": 0,
      "hostname": "dcos-01",
      "id": "20150827-210452-1695027628-5050-1445-0000",
      "name": "cassandra-unhealthy",
      "offered_resources": {
        "cpus": 0,
        "disk": 0,
        "mem": 0
      },
      "pid": "scheduler-88e0ffb7-5d54-4bc4-984b-e546d4b1ebb1@172.17.8.101:47277",
      "slave_ids": [
        "20151002-000353-1695027628-5050-1177-S0"
      ],
      "used_resources": {
        "cpus": 0.1,
        "disk": 0,
        "mem": 16,
        "ports": "[10000-10000]"
      },
      "webui_url": "http://$($MESOS_IP_DISCOVERY_COMMAND):8080"
    },
    {
      "TASK_ERROR": 0,
      "TASK_FAILED": 0,
      "TASK_FINISHED": 22,
      "TASK_KILLED": 0,
      "TASK_LOST": 0,
      "TASK_RUNNING": 1,
      "TASK_STAGING": 0,
      "TASK_STARTING": 0,
      "hostname": "dcos-01",
      "id": "20150827-210452-1695027628-5050-1445-0000",
      "name": "cassandra-na",
      "offered_resources": {
        "cpus": 0,
        "disk": 0,
        "mem": 0
      },
      "pid": "scheduler-88e0ffb7-5d54-4bc4-984b-e546d4b1ebb1@172.17.8.101:47277",
      "slave_ids": [
        "20151002-000353-1695027628-5050-1177-S0"
      ],
      "used_resources": {
        "cpus": 0.1,
        "disk": 0,
        "mem": 16,
        "ports": "[10000-10000]"
      },
      "webui_url": "http://$($MESOS_IP_DISCOVERY_COMMAND):8080"
    },
    {
      "TASK_ERROR": 0,
      "TASK_FAILED": 0,
      "TASK_FINISHED": 22,
      "TASK_KILLED": 0,
      "TASK_LOST": 0,
      "TASK_RUNNING": 1,
      "TASK_STAGING": 0,
      "TASK_STARTING": 0,
      "hostname": "dcos-01",
      "id": "20150827-210452-1695027628-5050-1445-0000",
      "name": "cassandra-idle",
      "offered_resources": {
        "cpus": 0,
        "disk": 0,
        "mem": 0
      },
      "pid": "scheduler-88e0ffb7-5d54-4bc4-984b-e546d4b1ebb1@172.17.8.101:47277",
      "slave_ids": [
        "20151002-000353-1695027628-5050-1177-S0"
      ],
      "used_resources": {
        "cpus": 0.1,
        "disk": 0,
        "mem": 16,
        "ports": "[10000-10000]"
      },
      "webui_url": "http://$($MESOS_IP_DISCOVERY_COMMAND):8080"
    }
  ],
  "hostname": "172.17.8.101",
  "slaves": [
    {
      "TASK_ERROR": 0,
      "TASK_FAILED": 0,
      "TASK_FINISHED": 22,
      "TASK_KILLED": 0,
      "TASK_LOST": 0,
      "TASK_RUNNING": 1,
      "TASK_STAGING": 0,
      "TASK_STARTING": 0,
      "active": true,
      "attributes": {
        
      },
      "framework_ids": [
        "20150827-210452-1695027628-5050-1445-0000"
      ],
      "hostname": "dcos-01",
      "id": "20151002-000353-1695027628-5050-1177-S0",
      "offered_resources": {
        "cpus": 0,
        "disk": 0,
        "mem": 0
      },
      "pid": "slave(1)@172.17.8.101:5051",
      "registered_time": 1443995289.19971,
      "reregistered_time": 1443995289.19981,
      "reserved_resources": {
        
      },
      "resources": {
        "cpus": 4,
        "disk": 10823,
        "mem": 2933,
        "ports": "[1025-2180, 2182-3887, 3889-5049, 5052-8079, 8082-8180, 8182-32000]"
      },
      "unreserved_resources": {
        "cpus": 4,
        "disk": 10823,
        "mem": 2933,
        "ports": "[1025-2180, 2182-3887, 3889-5049, 5052-8079, 8082-8180, 8182-32000]"
      },
      "used_resources": {
        "cpus": 0.1,
        "disk": 0,
        "mem": 16,
        "ports": "[10000-10000]"
      }
    }
  ]
}
